{
    "profile": {
        "lines": [
            "あぷりばーど / @apricotappbird",
            "川口 竜斉 / Ryosei Kawaguchi",
            "Birth: 2002-11-27"
        ]
    },
    "affiliation": {
        "ja": [
            "関西学院大学大学院 理工学研究科",
            "片寄研究室（エンタテインメントコンピューティング研究室）",
            "修士1年"
        ],
        "en": "Kwansei Gakuin University: Information Engineering Katayose Laboratory (Entertainment Computing)"
    },
    "researchCategories": [
        {
            "title": "EC分野のデザインパターン集積に向けたフレームワークの構築",
            "items": [
                {
                    "authors": "川口 竜斉 , 平山 心 , 片寄 晴弘：",
                    "title": "体験記録の蓄積に向けたRe:commend-demoの記述とEDC形式の体験記述の比較検討",
                    "url": "https://appbird.github.io/recdemo-vs-edc",
                    "badges": [
                        { "className": "u-reviewed", "text": "査読あり" },
                        { "className": "u-award", "text": "プレミアム発表" }
                    ],
                    "presentations": [
                        { "className": "u-poster", "text": "ポスター発表" }
                    ],
                    "where": "情報処理学会 インタラクション2026, 2026-03-03"
                },
                {
                    "authors": "川口 竜斉 , 平山 心 , 片寄 晴弘：",
                    "title": "体験の知覚-認知過程に着目したEntertainment Design Catalogの提案とEC学術領域に関する一考察",
                    "url": "https://appbird.github.io/entertainment-design-catalog",
                    "badges": [
                        { "className": "u-reviewed", "text": "査読あり" },
                        { "className": "u-award", "text": "特選セッション最優秀賞" },
                        { "className": "u-award", "text": "対話発表賞" }
                    ],
                    "presentations": [
                        { "className": "u-oral", "text": "口頭発表" },
                        { "className": "u-poster", "text": "デモ発表" }
                    ],
                    "where": "情報処理学会 エンタテインメントコンピューティング研究会 Entertainment Computing 2025, 2025-08-27"
                }
            ]
        },
        {
            "title": "大規模言語モデルと作編曲システムにおけるディレクション",
            "items": [
                {
                    "authors": "川口 竜斉 , 片寄 晴弘：",
                    "title": "大規模言語モデルを用いた作編曲システムにおけるカスタマイズ可能なパラメータ制御",
                    "url": "https://appbird.github.io/GraziaPianoTuner-Experiments/",
                    "badges": [
                        { "className": "u-reviewed", "text": "査読あり" }
                    ],
                    "presentations": [
                        { "className": "u-journal", "text": "論文誌" }
                    ],
                    "where": "情報処理学会論文誌, 67巻-04号（2026-04）"
                },
                {
                    "authors": "Ryosei Kawaguchi, Haruhiro Katayose:",
                    "title": "MuseLeader: Toward Music Editing through Time-series Semantic Parameters Control using Large Language Model",
                    "url": "https://appbird.github.io/muse-leader",
                    "badges": [
                        { "className": "u-reviewed", "text": "査読あり" }
                    ],
                    "presentations": [
                        { "className": "u-poster", "text": "ポスター発表" }
                    ],
                    "where": "The 17th International Symposium on Computer Music and Multidisciplinary Research (CMMR) 2025, 2025-11-04"
                },
                {
                    "authors": "川口 竜斉 , 片寄 晴弘：",
                    "title": "大規模言語モデルに基づく時系列概念パラメータ制御による作編曲システムの実装",
                    "url": "https://confit.atlas.jp/guide/event/jsai2025/subject/3O5-OS-22a-02/entries",
                    "badges": [],
                    "presentations": [
                        { "className": "u-oral", "text": "口頭発表" }
                    ],
                    "where": "人工知能学会 全国大会（第39回）, 2025-05-29"
                },
                {
                    "authors": "川口 竜斉 , 片寄 晴弘：",
                    "title": "GPT-MCR: 聴取系フィードバック機構を組み込んだLLMベースの作曲システムの検討",
                    "url": "https://ipsj.ixsq.nii.ac.jp/ej/?action=repository_uri&item_id=238211",
                    "badges": [
                        { "className": "u-award", "text": "学生奨励賞（Best New Direction）" }
                    ],
                    "presentations": [
                        { "className": "u-oral", "text": "口頭発表" }
                    ],
                    "where": "情報処理学会 音楽情報科学研究会 音楽情報科学研究会(SIGMUS), 2024-08-27"
                },
                {
                    "authors": "川口 竜斉 , 片寄 晴弘：",
                    "title": "GPT-4による対話的音楽生成の可能性と課題",
                    "url": "https://cir.nii.ac.jp/crid/1390300446018756352",
                    "badges": [],
                    "presentations": [
                        { "className": "u-poster", "text": "デモ発表" }
                    ],
                    "where": "2024年度 人工知能学会 全国大会（第38回）, 2024-05-28"
                },
                {
                    "authors": "川口 竜斉 , 片寄 晴弘：",
                    "title": "GPT-4による対話的音楽生成のためのプロンプトエンジニアリング",
                    "url": "https://ipsj.ixsq.nii.ac.jp/ej/?action=repository_uri&item_id=227463",
                    "badges": [
                        { "className": "u-award", "text": "優秀研究賞" }
                    ],
                    "presentations": [
                        { "className": "u-oral", "text": "口頭発表" },
                        { "className": "u-poster", "text": "デモ発表" }
                    ],
                    "where": "情報処理学会 エンタテインメントコンピューティング研究会 Entertainment Computing 2023, 107 - 112, 2023-09-02"
                }
            ]
        }
    ],
    "workCategories": [
        
        {
            "title": "Landscape Wander: 現実の風景を2Dプラットフォームフィールドにする試み",
            "items": [
                {
                    "authors": "川口 竜斉 , 片寄 晴弘：",
                    "title": "スマホ写真でゲームフィールドを作る多人数参加型 2D プラットフォームゲーム\"Landscape Extenders\"",
                    "badges": [
                        { "className": "u-reviewed", "text": "査読あり" }
                    ],
                    "presentations": [
                        { "className": "u-journal", "text": "論文誌" }
                    ],
                    "where": "情報処理学会 論文誌 「エンタテインメントコンピューティング」特集号 (2025年度) テクニカルペーパー"
                },
                {
                    "authors": "川口 竜斉 , 平野 砂峰旅 , 片寄 晴弘：",
                    "title": "Landscape Extenders:スマホ写真の投稿でフィールドが作られる2Dプラットフォームゲーム",
                    "badges": [],
                    "presentations": [
                        { "className": "u-poster", "text": "デモ発表" }
                    ],
                    "where": "情報処理学会 エンタテインメントコンピューティング研究会 Entertainment Computing 2024, 2024-09-03"
                },
                {
                    "authors": "川口 竜斉 , 平野 砂峰旅 , 片寄 晴弘：",
                    "title": "Landscape Wander: 現実世界の写真を2Dアクションゲームのフィールドとして利用する手法とその応用",
                    "url": "https://youtu.be/2X_ZQukCaTs?si=bCN7MlohwxzI8iPP",
                    "badges": [
                        { "className": "u-award", "text": "デモ発表賞 第2位" }
                    ],
                    "presentations": [
                        { "className": "u-oral", "text": "口頭発表" },
                        { "className": "u-poster", "text": "デモ発表" }
                    ],
                    "where": "情報処理学会 エンタテインメントコンピューティング研究会 第71回研究発表会, 2024-03-17"
                }
            ]
        }
    ],
    "career": [
        "2024-04-25 -- 2025-12-26: Research Assistant at Sony CSL (Music Generation)"
    ],
    "skills": {
        "items": [
            "音楽情報処理",
            "レイトレーシングの基礎",
            "競技プログラミング",
            "Webアプリケーション開発（フロントエンド・バックエンド）",
            "画像情報処理",
            "ゲーム開発"
        ],
        "atcoder": {
            "rateText": "rate 970 (緑)",
            "referenceText": "Algorithm部門のレーティングと業務における期待できる活躍 -- AtCoder",
            "referenceUrl": "https://info.atcoder.jp/utilize/jobs/rating-business-impact"
        }
    },
    "languages": [
        {
            "name": "C・C++",
            "usage": "ゲーム開発 (with OpenSiv3D) / 競技プログラミング"
        },
        {
            "name": "Python",
            "usage": "音楽情報処理・大規模言語モデル"
        },
        {
            "name": "Rust",
            "usage": "ソフトウェアラスタライザの制作・CLIアプリケーション"
        },
        {
            "name": "TypeScript",
            "usage": "Webアプリケーション（フロントエンド・バックエンド）開発"
        },
        {
            "name": "C# (Unity)",
            "usage": "自作プログラミング言語のインタプリタ共同開発・ゲーム開発"
        }
    ],
    "interest": "コンピュータグラフィクス, コンパイラ",
    "hobby": "紅茶，クラシカルロリィタ，イラスト（お絵描き）",
    "links": [
        { "label": "X(Twitter)", "url": "https://twitter.com/apricotappbird" },
        { "label": "Cosence", "url": "https://scrapbox.io/appbirdNotebook-public/Appbird" },
        { "label": "GitHub", "url": "https://github.com/Appbird" },
        { "label": "AtCoder", "url": "https://atcoder.jp/users/Appbird" },
        { "label": "VRChat", "url": "https://vrchat.com/home/user/usr_1eaefaae-9479-422a-a1eb-2d475ff87f48" }
    ]
}
